{"organizations": [], "uuid": "213bdd2933e89fb36de09a7b7817d5db13d3be88", "thread": {"social": {"gplus": {"shares": 0}, "pinterest": {"shares": 0}, "vk": {"shares": 0}, "linkedin": {"shares": 0}, "facebook": {"likes": 0, "shares": 0, "comments": 0}, "stumbledupon": {"shares": 0}}, "site_full": "in.reuters.com", "main_image": "https://s3.reutersmedia.net/resources/r/?d=20180201&i=RCV004GNP&w=1200&r=RCV004GNP&t=2", "site_section": "http://feeds.reuters.com/reuters/VideoINLatest\r", "section_title": "Reuters Video: Latest Videos IN", "url": "https://in.reuters.com/video/2018/02/01/davos-panel-discussion-looks-at-investin?videoId=390286696", "country": "US", "domain_rank": 408, "title": "Davos panel discussion looks at investing in frontier markets", "performance_score": 0, "site": "reuters.com", "participants_count": 0, "title_full": "", "spam_score": 0.0, "site_type": "news", "published": "2018-02-02T01:30:00.000+02:00", "replies_count": 0, "uuid": "213bdd2933e89fb36de09a7b7817d5db13d3be88"}, "author": "", "url": "https://in.reuters.com/video/2018/02/01/davos-panel-discussion-looks-at-investin?videoId=390286696", "ord_in_thread": 0, "title": "Davos panel discussion looks at investing in frontier markets", "locations": [], "entities": {"persons": [{"name": "davos", "sentiment": "negative"}, {"name": "carlos pascual", "sentiment": "none"}, {"name": "claudia cooper fort", "sentiment": "none"}, {"name": "mustafa abdel-wadood", "sentiment": "none"}, {"name": "anna marrs", "sentiment": "none"}], "locations": [{"name": "davos", "sentiment": "none"}, {"name": "davos", "sentiment": "none"}, {"name": "claver gatete", "sentiment": "none"}, {"name": "rwanda", "sentiment": "none"}, {"name": "peru", "sentiment": "none"}], "organizations": [{"name": "reuters", "sentiment": "negative"}, {"name": "abraaj group", "sentiment": "none"}, {"name": "east asia private banking", "sentiment": "none"}, {"name": "world economic forum", "sentiment": "none"}, {"name": "standard chartered", "sentiment": "none"}, {"name": "international affairs", "sentiment": "none"}, {"name": "global energy", "sentiment": "none"}, {"name": "ihs markit", "sentiment": "none"}]}, "highlightText": "", "language": "english", "persons": [], "text": "Davos panel discussion looks at investing in frontier markets 5:12am IST - 69:29 \nDAVOS - Reuters leads a panel discussion at the World Economic Forum in Davos which looks at investing in frontier markets. PANELISTS: Mustafa Abdel-Wadood, Managing Partner & Head of Private Equity, The Abraaj Group; Claver Gatete, Minister of Finance and Economic Planning, Rwanda; Claudia Cooper Fort, Minister of Economy and Finance, Peru; Anna Marrs, CEO, East Asia Private Banking, Standard Chartered; Carlos Pascual, Senior Vice President, Global Energy, International Affairs, IHS Markit ▲ Hide Transcript ▶ View Transcript \nDAVOS - Reuters leads a panel discussion at the World Economic Forum in Davos which looks at investing in frontier markets. PANELISTS: Mustafa Abdel-Wadood, Managing Partner & Head of Private Equity, The Abraaj Group; Claver Gatete, Minister of Finance and Economic Planning, Rwanda; Claudia Cooper Fort, Minister of Economy and Finance, Peru; Anna Marrs, CEO, East Asia Private Banking, Standard Chartered; Carlos Pascual, Senior Vice President, Global Energy, International Affairs, IHS Markit Press CTRL+C (Windows), CMD+C (Mac), or long-press the URL below on your mobile device to copy the code https://in.reuters.com/video/2018/02/01/davos-panel-discussion-looks-at-investin?videoId=390286696&videoChannel=13423", "external_links": [], "published": "2018-02-02T01:30:00.000+02:00", "crawled": "2018-02-02T03:36:38.000+02:00", "highlightTitle": ""}