{"organizations": [], "uuid": "8852d5cbb41954788a5e04a405de73fe8fa763fa", "thread": {"social": {"gplus": {"shares": 0}, "pinterest": {"shares": 0}, "vk": {"shares": 0}, "linkedin": {"shares": 0}, "facebook": {"likes": 0, "shares": 0, "comments": 0}, "stumbledupon": {"shares": 0}}, "site_full": "www.cnbc.com", "main_image": "", "site_section": "http://www.cnbc.com/id/10000027", "section_title": "Press Releases - CNBC", "url": "http://www.cnbc.com/2018/02/28/cnbc-exclusive-palantir-technologies-co-founder-ceo-alex-karp-joins-cnbcs-josh-lipton-for-rare-interview-airing-on-cnbcs-squawk-alley-tomorrow.html", "country": "US", "domain_rank": 767, "title": "CNBC EXCLUSIVE: PALANTIR TECHNOLOGIES CO-FOUNDER & CEO ALEX KARP JOINS CNBC’S JOSH LIPTON FOR RARE INTERVIEW AIRING ON CNBC’S “SQUAWK ALLEY” TOMORROW", "performance_score": 0, "site": "cnbc.com", "participants_count": 1, "title_full": "", "spam_score": 0.004, "site_type": "news", "published": "2018-02-28T22:21:00.000+02:00", "replies_count": 0, "uuid": "8852d5cbb41954788a5e04a405de73fe8fa763fa"}, "author": "cnbc.com", "url": "http://www.cnbc.com/2018/02/28/cnbc-exclusive-palantir-technologies-co-founder-ceo-alex-karp-joins-cnbcs-josh-lipton-for-rare-interview-airing-on-cnbcs-squawk-alley-tomorrow.html", "ord_in_thread": 0, "title": "CNBC EXCLUSIVE: PALANTIR TECHNOLOGIES CO-FOUNDER & CEO ALEX KARP JOINS CNBC’S JOSH LIPTON FOR RARE INTERVIEW AIRING ON CNBC’S “SQUAWK ALLEY” TOMORROW", "locations": [], "entities": {"persons": [{"name": "josh lipton", "sentiment": "neutral"}, {"name": "alex karp", "sentiment": "neutral"}, {"name": "palantir", "sentiment": "none"}, {"name": "emma martin", "sentiment": "none"}, {"name": "jennifer dauble", "sentiment": "none"}, {"name": "trump", "sentiment": "none"}], "locations": [{"name": "middle east", "sentiment": "none"}, {"name": "canada", "sentiment": "none"}, {"name": "u.s.", "sentiment": "none"}, {"name": "asia pacific", "sentiment": "none"}, {"name": "united states", "sentiment": "none"}, {"name": "europe", "sentiment": "none"}, {"name": "china", "sentiment": "none"}, {"name": "africa", "sentiment": "none"}, {"name": "silicon valley", "sentiment": "none"}], "organizations": [{"name": "cnbc", "sentiment": "neutral"}, {"name": "cnbc world", "sentiment": "none"}]}, "highlightText": "", "language": "english", "persons": [], "text": "WHEN: TOMORROW, WEDNESDAY, FEBRUARY 28 AT 11AM ET\nWHERE: CNBC'S \"SQUAWK ALLEY\"\nPalantir Co-founder and CEO Alex Karp sits down with CNBC's Josh Lipton for a rare and exclusive interview airing on CNBC's \"Squawk Alley\" tomorrow, Wednesday, February 28 at 11am ET. Topics include: Palantir's latest customers, valuation/IPO, views on Silicon Valley and jobs and President Trump, among others.\nTranscript to follow the interview.\nFor more information contact:\nJennifer Dauble\nCNBC\nt: 201.735.4721\nm: 201.615.2787\ne: jennifer.dauble@nbcuni.com\nEmma Martin\nCNBC\nt: 201.735.4713\nm: 551.275.5221\ne: emma.martin@nbcuni.com\nAbout CNBC:\nWith CNBC in the U.S., CNBC in Asia Pacific, CNBC in Europe, Middle East and Africa, and CNBC World, CNBC is the recognized world leader in business news and provides real-time financial market coverage and business information to more than 409 million homes worldwide, including more than 91 million households in the United States and Canada. CNBC also provides daily business updates to 400 million households across China. The network's 15 live hours a day of business programming in North America (weekdays from 4:00 a.m. - 7:00 p.m. ET) is produced at CNBC's global headquarters in Englewood Cliffs, N.J., and includes reports from CNBC News bureaus worldwide. CNBC at night features a mix of new reality programming, CNBC's highly successful series produced exclusively for CNBC and a number of distinctive in-house documentaries.\nCNBC also has a vast portfolio of digital products which deliver real-time financial market news and information across a variety of platforms including: CNBC.com; CNBC PRO, the premium, integrated desktop/mobile service that provides live access to CNBC programming, exclusive video content and global market data and analysis; a suite of CNBC mobile products including the CNBC Apps for iOS, Android and Windows devices; and additional products such as the CNBC App for the Apple Watch and Apple TV.\nMembers of the media can receive more information about CNBC and its programming on the NBCUniversal Media Village Web site at http://www.nbcumv.com/programming/cnbc .\nFor more information about NBCUniversal, please visit http://www.NBCUniversal.com .", "external_links": ["http://www.nbcumv.com/programming/cnbc"], "published": "2018-02-28T22:21:00.000+02:00", "crawled": "2018-02-28T23:16:32.037+02:00", "highlightTitle": ""}