{"organizations": [], "uuid": "f45b3e6f15190b066122ae516e7a2f35ce26bef4", "thread": {"social": {"gplus": {"shares": 0}, "pinterest": {"shares": 0}, "vk": {"shares": 0}, "linkedin": {"shares": 0}, "facebook": {"likes": 0, "shares": 0, "comments": 0}, "stumbledupon": {"shares": 0}}, "site_full": "www.cnbc.com", "main_image": "", "site_section": "http://www.cnbc.com/id/10000027/page/2", "section_title": "Press Releases - CNBC", "url": "http://www.cnbc.com/2018/04/16/cnbc-goes-live-from-abu-dhabi.html", "country": "US", "domain_rank": 767, "title": "CNBC GOES LIVE FROM ABU DHABI", "performance_score": 0, "site": "cnbc.com", "participants_count": 1, "title_full": "", "spam_score": 0.163, "site_type": "news", "published": "2018-04-16T13:11:00.000+03:00", "replies_count": 0, "uuid": "f45b3e6f15190b066122ae516e7a2f35ce26bef4"}, "author": "cnbc.com", "url": "http://www.cnbc.com/2018/04/16/cnbc-goes-live-from-abu-dhabi.html", "ord_in_thread": 0, "title": "CNBC GOES LIVE FROM ABU DHABI", "locations": [], "entities": {"persons": [{"name": "nancy hungerford", "sentiment": "none"}], "locations": [{"name": "middle east", "sentiment": "none"}, {"name": "uae capital's international financial centre", "sentiment": "none"}, {"name": "singapore", "sentiment": "none"}, {"name": "u.s.", "sentiment": "none"}, {"name": "asia", "sentiment": "none"}, {"name": "europe", "sentiment": "none"}, {"name": "middle east headquarters", "sentiment": "none"}, {"name": "middle east anchor", "sentiment": "none"}, {"name": "abu dhabi", "sentiment": "none"}], "organizations": [{"name": "cnbc", "sentiment": "negative"}, {"name": "abu dhabi abu dhabi", "sentiment": "negative"}, {"name": "hadley gamble", "sentiment": "none"}, {"name": "abu dhabi global market", "sentiment": "none"}, {"name": "adgm", "sentiment": "none"}, {"name": "capital connection", "sentiment": "none"}, {"name": "cnbc international", "sentiment": "none"}, {"name": "middle east anchor hadley gamble", "sentiment": "none"}]}, "highlightText": "", "language": "english", "persons": [], "text": "Abu Dhabi, Monday 16 th April â€“ CNBC, the world's number one business and financial news network, today unveiled its new Middle East Headquarters in Abu Dhabi. The state-of-the-art facility will act as CNBC's hub in the Middle East from which the network will continue to deliver world-class business content from across the region.\nAs of today, the network will broadcast Capital Connection, fronted by its Middle East Anchor Hadley Gamble from its new studios based within Abu Dhabi Global Market (ADGM), the UAE Capital's International Financial Centre. CNBC's Nancy Hungerford will co-anchor the show from the network's Asia Headquarters within the Singapore Exchange, bringing viewers across the world daily coverage of the Middle East markets, business stories and regional news from Asia, Europe and the U.S.\nSpeaking after the inaugural show, Hadley Gamble, Middle East Anchor at CNBC International, said: \"We've been reporting the Middle East business story to CNBC's elite global audience for years. The launch of our new home within ADGM starts a new chapter in our reporting from the region. These new state-of-the-art studios provide us with a fantastic platform to tell the global business story through a unique Middle East lens.\"\nDuring the show, CNBC unveiled an impressive guest line-up for its first week of programming from the Middle East, including exclusive interviews with Mohamed Khalifa Al Mubarak, Chairman of Aldar Properties; HE Saif Saeed Ghobash, Director General of Abu Dhabi Department of Culture and Tourism; Jassim Alseddiqi, CEO of Abu Dhabi Financial Group; Saudi Prince Turki Al-Faisal and Mohammed Al Ardhi, Chairman of Investcorp. On today's show, Gamble was joined by Peter Baumgartner, CEO of Etihad Airways; Luka Mucic, CFO of SAP and Egyptian billionaire Naguib Sawiris.\nJohn Casey, CNBC's SVP of International News and Programming said: \"CNBC broadcasts daily from the network's International Headquarters in New York, London and Singapore. With the addition of our new Middle East Headquarters at ADGM, we plan to connect Abu Dhabi to the world's financial capitals.\"\nThe network will also use its new home in Abu Dhabi to establish a stronger editorial presence across the region. CNBC has also said it will expand both its feature franchise Access Middle East and its regional event coverage as part of its expansion.\nENDS\nNotes to editors:\nA section of CNBC images of Hadley Gamble in CNBC's new Middle East Headquarters can be downloaded here: https://we.tl/NwFJgt6IdZ Capital Connection will be live daily from Abu Dhabi between 8am and 9am GST, Monday to Thursday on CNBC Arabic translation of this press release is available on request For more information contact:\nLee Thompson\nHead of Communications, CNBC International\nlee.thompson@CNBC.com / +44 (0)7880 088314.\nAbout CNBC:\nCNBC is the leading global broadcaster of live business and financial news and information, reporting directly from the major financial markets around the globe with regional headquarters Singapore, Abu Dhabi, London and New York. The TV channel is available in more than 410 million homes worldwide.\nCNBC.com is the preeminent financial news source on the web, featuring an unprecedented amount of video, real-time market analysis, web-exclusive live video and analytical financial tools.\nCNBC is a division of NBCUniversal. For more information, visit www.cnbc.com .", "external_links": ["https://we.tl/NwFJgt6IdZ"], "published": "2018-04-16T13:11:00.000+03:00", "crawled": "2018-04-16T14:37:58.012+03:00", "highlightTitle": ""}