{"organizations": [], "uuid": "0d254a0a45aa70053bb74731bde7dc65b3ea6cb8", "thread": {"social": {"gplus": {"shares": 0}, "pinterest": {"shares": 0}, "vk": {"shares": 0}, "linkedin": {"shares": 0}, "facebook": {"likes": 0, "shares": 0, "comments": 0}, "stumbledupon": {"shares": 0}}, "site_full": "www.cnbc.com", "main_image": "", "site_section": "http://www.cnbc.com/id/10000027/page/2", "section_title": "Press Releases - CNBC", "url": "http://www.cnbc.com/2018/04/25/cnbc-media-alert-cnbcs-squawk-on-the-street-brings-big-lineup-for-earnings-tomorrow-thursday-april-26.html", "country": "US", "domain_rank": 767, "title": "CNBC Media Alert: CNBC’s “Squawk on the Street” Brings Big Lineup for Earnings Tomorrow, Thursday, April 26", "performance_score": 0, "site": "cnbc.com", "participants_count": 1, "title_full": "", "spam_score": 0.0, "site_type": "news", "published": "2018-04-26T02:20:00.000+03:00", "replies_count": 0, "uuid": "0d254a0a45aa70053bb74731bde7dc65b3ea6cb8"}, "author": "cnbc.com", "url": "http://www.cnbc.com/2018/04/25/cnbc-media-alert-cnbcs-squawk-on-the-street-brings-big-lineup-for-earnings-tomorrow-thursday-april-26.html", "ord_in_thread": 0, "title": "CNBC Media Alert: CNBC’s “Squawk on the Street” Brings Big Lineup for Earnings Tomorrow, Thursday, April 26", "locations": [], "entities": {"persons": [{"name": "lisa su", "sentiment": "none"}, {"name": "steve mollenkopf", "sentiment": "none"}, {"name": "hugh johnston", "sentiment": "none"}, {"name": "brian niccol", "sentiment": "none"}, {"name": "lance fritz", "sentiment": "none"}, {"name": "jennifer dauble", "sentiment": "none"}, {"name": "gary kelly", "sentiment": "none"}], "locations": [{"name": "middle east", "sentiment": "none"}, {"name": "canada", "sentiment": "none"}, {"name": "u.s.", "sentiment": "none"}, {"name": "asia pacific", "sentiment": "none"}, {"name": "united states", "sentiment": "none"}, {"name": "europe", "sentiment": "none"}, {"name": "africa", "sentiment": "none"}], "organizations": [{"name": "cnbc", "sentiment": "negative"}, {"name": "cnbc media alert", "sentiment": "negative"}, {"name": "pepsico", "sentiment": "none"}, {"name": "southwest airlines", "sentiment": "none"}, {"name": "cnbc world", "sentiment": "none"}, {"name": "qualcomm", "sentiment": "none"}, {"name": "jennifer.dauble@nbcuni.com emma martin cnbc", "sentiment": "none"}, {"name": "amd", "sentiment": "none"}, {"name": "union pacific", "sentiment": "none"}]}, "highlightText": "", "language": "english", "persons": [], "text": "WHEN: Tomorrow, Thursday, April 26, 2018\nWHERE: CNBC's \" Squawk on the Street \"\nCNBC's \"Squawk on the Street\" (M-F 9AM – 11AM) will feature a packed lineup of CNBC EXCLUSIVE and FIRST ON CNBC interviews tomorrow, Thursday, April 26th timed to earnings, including: AMD CEO Lisa Su ; Chipotle CEO Brian Niccol ; Southwest Airlines CEO Gary Kelly ; Union Pacific Chairman, President and CEO Lance Fritz ; Qualcomm CEO Steve Mollenkopf ; and Pepsico CFO and Vice Chairman Hugh Johnston .\nExcerpts and transcripts to follow interviews.\nFor more information contact:\nJennifer Dauble\nCNBC\nt: 201.735.4721\nm: 201.615.2787\ne: jennifer.dauble@nbcuni.com\nEmma Martin\nCNBC\nt: 201.735.4713\nm: 551.275.6221\ne: emma.martin@nbcuni.com\nAbout CNBC:\nWith CNBC in the U.S., CNBC in Asia Pacific, CNBC in Europe, Middle East and Africa, and CNBC World, CNBC is the recognized world leader in business news and provides real-time financial market coverage and business information to more than 409 million homes worldwide, including more than 91 million households in the United States and Canada. CNBC also provides daily business updates to 400 million households across China. The network's 15 live hours a day of business programming in North America (weekdays from 4:00 a.m. - 7:00 p.m. ET) is produced at CNBC's global headquarters in Englewood Cliffs, N.J., and includes reports from CNBC News bureaus worldwide. CNBC at night features a mix of new reality programming, CNBC's highly successful series produced exclusively for CNBC and a number of distinctive in-house documentaries.\nCNBC Digital delivers more than 50 million multi-platform unique visitors each month. CNBC.com provides real-time financial market news and information to CNBC's investor audience. CNBC Make It is a digital destination focused on making you smarter about how you earn, save and spend your money by zeroing in on careers, leadership, entrepreneurship and personal finance.\nCNBC has a vast portfolio of digital products across a variety of platforms including: CNBC.com; CNBC PRO, the premium, integrated desktop/mobile service that provides live access to CNBC programming, exclusive video content and global market data and analysis; a suite of CNBC mobile products including the CNBC Apps for iOS, Android and Windows devices; and additional products such as the CNBC App for the Apple Watch and Apple TV.\nMembers of the media can receive more information about CNBC and its programming on the NBCUniversal Media Village Web site at http://www.nbcumv.com/programming/cnbc .\nFor more information about NBCUniversal, please visit http://www.NBCUniversal.com .", "external_links": ["http://www.nbcuniversal.com/", "https://wpyadmin.ne.cision.com/l/optwprtz/www.cnbc.com/squawk-on-the-street", "http://www.nbcumv.com/programming/cnbc"], "published": "2018-04-26T02:20:00.000+03:00", "crawled": "2018-04-26T04:26:46.000+03:00", "highlightTitle": ""}