{"organizations": [], "uuid": "d2bea57004bbb3c9c7c7c70a12a1d2a437148218", "thread": {"social": {"gplus": {"shares": 0}, "pinterest": {"shares": 0}, "vk": {"shares": 0}, "linkedin": {"shares": 0}, "facebook": {"likes": 0, "shares": 0, "comments": 0}, "stumbledupon": {"shares": 0}}, "site_full": "www.cnbc.com", "main_image": "https://fm.cnbc.com/applications/cnbc.com/resources/img/editorial/2016/01/04/103277890-GettyImages-503349982.1910x1000.jpg", "site_section": "https://www.cnbc.com/id/100003114/device/rss/rss.html", "section_title": "Top News &amp;amp; Analysis", "url": "https://www.cnbc.com/2018/04/10/stocks-making-the-biggest-moves-premarket-gs-nvda-pm-ten-iep-nke-ual-more.html", "country": "US", "domain_rank": 767, "title": "Stocks making the biggest moves premarket: GS, NVDA, PM, TEN, IEP, NKE, UAL & more", "performance_score": 0, "site": "cnbc.com", "participants_count": 1, "title_full": "", "spam_score": 0.0, "site_type": "news", "published": "2018-04-10T16:03:00.000+03:00", "replies_count": 0, "uuid": "d2bea57004bbb3c9c7c7c70a12a1d2a437148218"}, "author": "Peter Schacknow", "url": "https://www.cnbc.com/2018/04/10/stocks-making-the-biggest-moves-premarket-gs-nvda-pm-ten-iep-nke-ual-more.html", "ord_in_thread": 0, "title": "Stocks making the biggest moves premarket: GS, NVDA, PM, TEN, IEP, NKE, UAL & more", "locations": [], "entities": {"persons": [{"name": "bernstein", "sentiment": "none"}], "locations": [{"name": "bernstein", "sentiment": "none"}], "organizations": [{"name": "ual", "sentiment": "negative"}, {"name": "goldman sachs", "sentiment": "negative"}, {"name": "iep", "sentiment": "negative"}, {"name": "nvda", "sentiment": "negative"}, {"name": "nke", "sentiment": "negative"}, {"name": "philip morris international", "sentiment": "none"}, {"name": "nike", "sentiment": "none"}, {"name": "nvidia", "sentiment": "none"}, {"name": "tenneco", "sentiment": "none"}, {"name": "deutsche bank", "sentiment": "none"}, {"name": "federal-mogul", "sentiment": "none"}, {"name": "morgan stanley", "sentiment": "none"}, {"name": "icahn enterprises", "sentiment": "none"}]}, "highlightText": "", "language": "english", "persons": [], "text": "Stocks making the biggest moves premarket: GS, NVDA, PM, TEN, IEP, NKE, UAL & more Goldman Sachs landed an \"outperform\" rating under new coverage at Bernstein. Nvidia got an upgrade from Morgan Stanley. Tobacco giant Philip Morris International received a \"buy\" rating in new coverage from Deutsche Bank. CNBC.com Getty Images A trader works on the floor of the New York Stock Exchange during the morning of January 4, 2016 in New York City. \nCheck out the companies making headlines before the bell: \nGoldman Sachs – The investment firm was rated \"outperform\" in new coverage at Bernstein, which notes that strategic growth businesses such as investment banking have taken over from trading as a primary driver of revenue. At the same time, Bernstein rates Morgan Stanley \"underperform\", pointing to a slowdown in lending revenue growth among other factors. \nNvidia – The graphics chipmaker's stock was upgraded to \"overweight\" from \"equal-weight\" at Morgan Stanley, based in part on long term data investment trends. \nPhilip Morris International – The tobacco producer's stock was rated \"buy\" in new coverage at Deutsche Bank, based on potentially higher cash returns for investors. \nTenneco – The vehicle systems maker is buying powertrain systems maker Federal-Mogul from Icahn Enterprises for $5.4 billion in cash and stock. Tenneco, a maker of vehicle systems, plans to separate the combined businesses into two separate publicly traded companies. \nNike – The athletic footwear and apparel maker announced the acquisition of Tel Aviv-based Invertex for an undisclosed amount. Invertex makes software that scans a customer's body for proper product sizing. \nTupperware – The company lowered current quarter earnings and revenue guidance below current Wall Street consensus. The maker of storage products and other home goods points to lower sales as well as a negative impact from the new tax law. However, CEO Rick Goings expressed confidence in how Tupperware's business would perform over the longer term. \nUnited Continental – The airline reported a 6.5 percent increase in revenue passenger miles for March compared to a year earlier. \nVerifone – Verifone agreed to be acquired by a group led by private equity firm Francisco Partners for $2.58 billion in cash. The price for the payments technology company works out to $23.04 per share, a 54 percent premium over Monday's close. \nNovartis – Novartis will have a strengthened pipeline in gene therapy following its deal to acquire AveXis , according to a new report by credit rating agency Moody's. However, Moody's also said the deal will reduce the drug maker's financial flexibility. \nMcDonald's – McDonald's is expanding in Denmark, Sweden, Norway and Finland, announcing plans to open 200 restaurants in the region over the next 10 years. The restaurant chain says the expansion will boost the number of customers in those countries by a third. \nAlphabet – Alphabet's Google unit appealed a ruling from an India court that found it guilty of \"search bias,\" according to a Reuters report. \nFacebook – Facebook CEO Mark Zuckerberg begins two days of Capitol Hill testimony on Tuesday over the social network's privacy practices. \nTesla – National Transportation Safety Board Chairman Robert Sumwalt had a \"constructive\" conversation with Tesla CEO Elon Musk about the agency's examination of a fatal crash of a Tesla vehicle operating in Autopilot mode, according to an NTSB spokesman. \nIllinois Tool Works – Illinois Tool Works was added to the \"Conviction Buy\" list at Goldman Sachs. Goldman cites a number of positive factors for its recommendation of the manufacturing company's stock, including valuation. \nUlta Beauty – The cosmetics retailer was upgraded to \"overweight\" from \"neutral\" at Piper Jaffray, which cited a survey pointing to an reacceleration of spending on beauty products among teenagers. Peter Schacknow Senior Producer, CNBC Related Securities ", "external_links": [], "published": "2018-04-10T16:03:00.000+03:00", "crawled": "2018-04-10T15:51:40.000+03:00", "highlightTitle": ""}