{"organizations": [], "uuid": "f7463bbeaaede75a9773d4d759d392f3d07d1d1c", "thread": {"social": {"gplus": {"shares": 0}, "pinterest": {"shares": 0}, "vk": {"shares": 0}, "linkedin": {"shares": 0}, "facebook": {"likes": 0, "shares": 0, "comments": 0}, "stumbledupon": {"shares": 0}}, "site_full": "www.cnbc.com", "main_image": "", "site_section": "http://www.cnbc.com/id/10000027", "section_title": "Press Releases - CNBC", "url": "http://www.cnbc.com/2018/04/02/special-2-hour-edition-of-cnbcs-fast-money-airs-tonight-monday-4218.html", "country": "US", "domain_rank": 767, "title": "SPECIAL 2-HOUR EDITION OF CNBC’s “FAST MONEY” AIRS TONIGHT, MONDAY, 4/2/18", "performance_score": 0, "site": "cnbc.com", "participants_count": 1, "title_full": "", "spam_score": 0.281, "site_type": "news", "published": "2018-04-03T02:21:00.000+03:00", "replies_count": 0, "uuid": "f7463bbeaaede75a9773d4d759d392f3d07d1d1c"}, "author": "cnbc.com", "url": "http://www.cnbc.com/2018/04/02/special-2-hour-edition-of-cnbcs-fast-money-airs-tonight-monday-4218.html", "ord_in_thread": 0, "title": "SPECIAL 2-HOUR EDITION OF CNBC’s “FAST MONEY” AIRS TONIGHT, MONDAY, 4/2/18", "locations": [], "entities": {"persons": [{"name": "melissa lee", "sentiment": "none"}, {"name": "jennifer dauble", "sentiment": "none"}], "locations": [{"name": "n.j.", "sentiment": "none"}, {"name": "new york", "sentiment": "none"}, {"name": "united states", "sentiment": "none"}, {"name": "europe", "sentiment": "none"}, {"name": "africa", "sentiment": "none"}, {"name": "times square", "sentiment": "none"}, {"name": "north america", "sentiment": "none"}, {"name": "middle east", "sentiment": "none"}, {"name": "canada", "sentiment": "none"}, {"name": "u.s.", "sentiment": "none"}, {"name": "asia pacific", "sentiment": "none"}, {"name": "china", "sentiment": "none"}, {"name": "englewood cliffs", "sentiment": "none"}], "organizations": [{"name": "cnbc", "sentiment": "negative"}, {"name": "cnbc world", "sentiment": "none"}, {"name": "jennifer.dauble@nbcuni.com emma martin cnbc", "sentiment": "none"}]}, "highlightText": "", "language": "english", "persons": [], "text": "ALL TIMES IN ET\nMonday, 4/2/2018:\n5:00 PM FAST MONEY (2-hours) (replaces Mad Money from 6-7 PM)\nCNBC Special 2-Hour Edition of CNBC's \"Fast Money\" :\nSpecial 2-hour edition of CNBC's \"Fast Money\" anchored by Melissa Lee live from the Nasdaq MarketSite in New York's Times Square.\nFor more information contact:\nJennifer Dauble\nCNBC\nt: 201.735.4721\nm: 201.615.2787\ne: jennifer.dauble@nbcuni.com\nEmma Martin\nCNBC\nt: 201.735.4713\nm: 551.275.6221\ne: emma.martin@nbcuni.com\nAbout CNBC:\nWith CNBC in the U.S., CNBC in Asia Pacific, CNBC in Europe, Middle East and Africa, and CNBC World, CNBC is the recognized world leader in business news and provides real-time financial market coverage and business information to more than 409 million homes worldwide, including more than 91 million households in the United States and Canada. CNBC also provides daily business updates to 400 million households across China. The network's 15 live hours a day of business programming in North America (weekdays from 4:00 a.m. - 7:00 p.m. ET) is produced at CNBC's global headquarters in Englewood Cliffs, N.J., and includes reports from CNBC News bureaus worldwide. CNBC at night features a mix of new reality programming, CNBC's highly successful series produced exclusively for CNBC and a number of distinctive in-house documentaries.\nCNBC also has a vast portfolio of digital products which deliver real-time financial market news and information across a variety of platforms including: CNBC.com; CNBC PRO, the premium, integrated desktop/mobile service that provides live access to CNBC programming, exclusive video content and global market data and analysis; a suite of CNBC mobile products including the CNBC Apps for iOS, Android and Windows devices; and additional products such as the CNBC App for the Apple Watch and Apple TV.\nMembers of the media can receive more information about CNBC and its programming on the NBCUniversal Media Village Web site at http://www.nbcumv.com/programming/cnbc .\nFor more information about NBCUniversal, please visit http://www.NBCUniversal.com .", "external_links": ["http://www.nbcumv.com/programming/cnbc"], "published": "2018-04-03T02:21:00.000+03:00", "crawled": "2018-04-03T06:06:41.005+03:00", "highlightTitle": ""}