{"organizations": [], "uuid": "0e4ef66f3ecdebc4ddd3038b9d553e15b67a6046", "thread": {"social": {"gplus": {"shares": 0}, "pinterest": {"shares": 0}, "vk": {"shares": 0}, "linkedin": {"shares": 0}, "facebook": {"likes": 0, "shares": 0, "comments": 0}, "stumbledupon": {"shares": 0}}, "site_full": "www.cnbc.com", "main_image": "", "site_section": "http://www.cnbc.com/id/10000027", "section_title": "Press Releases - CNBC", "url": "http://www.cnbc.com/2018/04/16/cnbc-media-alert-a-special-edition-of-cnbcs-squawk-box-live-from-d-c-on-tuesday-april-17th.html", "country": "US", "domain_rank": 767, "title": "CNBC MEDIA ALERT: A SPECIAL EDITION OF CNBC’S “SQUAWK BOX” LIVE FROM D.C. ON TUESDAY, APRIL 17TH", "performance_score": 0, "site": "cnbc.com", "participants_count": 1, "title_full": "", "spam_score": 0.001, "site_type": "news", "published": "2018-04-17T00:27:00.000+03:00", "replies_count": 0, "uuid": "0e4ef66f3ecdebc4ddd3038b9d553e15b67a6046"}, "author": "cnbc.com", "url": "http://www.cnbc.com/2018/04/16/cnbc-media-alert-a-special-edition-of-cnbcs-squawk-box-live-from-d-c-on-tuesday-april-17th.html", "ord_in_thread": 0, "title": "CNBC MEDIA ALERT: A SPECIAL EDITION OF CNBC’S “SQUAWK BOX” LIVE FROM D.C. ON TUESDAY, APRIL 17TH", "locations": [], "entities": {"persons": [{"name": "cathy mcmorris rodgers", "sentiment": "none"}, {"name": "becky quick", "sentiment": "none"}, {"name": "kevin brady", "sentiment": "none"}, {"name": "steny hoyer", "sentiment": "none"}, {"name": "david perdue", "sentiment": "none"}, {"name": "kevin hassett", "sentiment": "none"}, {"name": "paul ryan", "sentiment": "none"}, {"name": "joe kernen", "sentiment": "none"}, {"name": "steven mnuchin", "sentiment": "none"}, {"name": "kevin mccarthy", "sentiment": "none"}, {"name": "mike allen", "sentiment": "none"}, {"name": "jennifer dauble", "sentiment": "none"}, {"name": "joshua bolten", "sentiment": "none"}], "locations": [{"name": "u.s.", "sentiment": "none"}, {"name": "rayburn room", "sentiment": "none"}, {"name": "asia pacific", "sentiment": "none"}, {"name": "u.s. capitol", "sentiment": "none"}, {"name": "texas", "sentiment": "none"}, {"name": "california", "sentiment": "none"}, {"name": "georgia", "sentiment": "none"}, {"name": "maryland", "sentiment": "none"}, {"name": "wisconsin", "sentiment": "none"}, {"name": "washington", "sentiment": "none"}], "organizations": [{"name": "cnbc", "sentiment": "negative"}, {"name": "former white house", "sentiment": "none"}, {"name": "jennifer.dauble@nbcuni.com emma martin cnbc", "sentiment": "none"}, {"name": "ways and means committee chair", "sentiment": "none"}, {"name": "house", "sentiment": "none"}, {"name": "council of economic advisers chair", "sentiment": "none"}]}, "highlightText": "", "language": "english", "persons": [], "text": "When: Tuesday, April 17, 2018 beginning at 6AM ET\nWhere: CNBC's \" Squawk Box \"\nTuesday, April 17th starting at 6AM ET, CNBC's \"Squawk Box\" will be live from the Rayburn Room in the U.S. Capitol with anchors Joe Kernen and Becky Quick for a special Tax Day episode.\nGuests will include: Steven Mnuchin, U.S. Treasury Secretary; Rep. Paul Ryan (R) Wisconsin, Speaker of the House; Kevin Hassett, Council of Economic Advisers Chair; Joshua Bolten , Business Roundtable President and CEO, Former White House Chief of Staff; Rep. Kevin Brady (R) Texas, Ways and Means Committee Chair; Rep. Kevin McCarthy (R) California, House Majority Leader; Rep. Steny Hoyer (D) Maryland, House Democratic Whip; Rep. Cathy McMorris Rodgers (R) Washington, House Republican Conference Chair; Sen. David Perdue (R) Georgia; and Mike Allen , Axios Executive Editor.\nFor more information contact:\nJennifer Dauble\nCNBC\nt: 201.735.4721\nm: 201.615.2787\ne: jennifer.dauble@nbcuni.com\nEmma Martin\nCNBC\nt: 201.735.4713\nm: 551.275.6221\ne: emma.martin@nbcuni.com\nAbout CNBC:\nWith CNBC in the U.S., CNBC in Asia Pacific, CNBC in Europe, Middle East and Africa, and CNBC World, CNBC is the recognized world leader in business news and provides real-time financial market coverage and business information to more than 409 million homes worldwide, including more than 91 million households in the United States and Canada. CNBC also provides daily business updates to 400 million households across China. The network's 15 live hours a day of business programming in North America (weekdays from 4:00 a.m. - 7:00 p.m. ET) is produced at CNBC's global headquarters in Englewood Cliffs, N.J., and includes reports from CNBC News bureaus worldwide. CNBC at night features a mix of new reality programming, CNBC's highly successful series produced exclusively for CNBC and a number of distinctive in-house documentaries.\nCNBC Digital delivers more than 50 million multi-platform unique visitors each month. CNBC.com provides real-time financial market news and information to CNBC's investor audience. CNBC Make It is a digital destination focused on making you smarter about how you earn, save and spend your money by zeroing in on careers, leadership, entrepreneurship and personal finance.\nCNBC has a vast portfolio of digital products across a variety of platforms including: CNBC.com; CNBC PRO, the premium, integrated desktop/mobile service that provides live access to CNBC programming, exclusive video content and global market data and analysis; a suite of CNBC mobile products including the CNBC Apps for iOS, Android and Windows devices; and additional products such as the CNBC App for the Apple Watch and Apple TV.\nMembers of the media can receive more information about CNBC and its programming on the NBCUniversal Media Village Web site at http://www.nbcumv.com/programming/cnbc .\nFor more information about NBCUniversal, please visit http://www.NBCUniversal.com .", "external_links": ["https://wpyadmin.ne.cision.com/l/tojektqy/www.cnbc.com/squawk-box-us", "http://www.nbcumv.com/programming/cnbc", "http://www.nbcuniversal.com/"], "published": "2018-04-17T00:27:00.000+03:00", "crawled": "2018-04-17T01:43:45.002+03:00", "highlightTitle": ""}