{"organizations": [], "uuid": "1c93a0527f4b0d8f985703da92b5002e2c7a5c65", "thread": {"social": {"gplus": {"shares": 0}, "pinterest": {"shares": 0}, "vk": {"shares": 0}, "linkedin": {"shares": 0}, "facebook": {"likes": 7, "shares": 7, "comments": 0}, "stumbledupon": {"shares": 0}}, "site_full": "www.cnbc.com", "main_image": "", "site_section": "http://www.cnbc.com/id/10000027/page/3", "section_title": "Press Releases - CNBC", "url": "http://www.cnbc.com/2018/03/21/an-all-new-supersized-jay-lenos-garage-premieres-thursday-april-19-at-10pm-etpt.html", "country": "US", "domain_rank": 767, "title": "AN ALL-NEW SUPERSIZED ‘JAY LENO’S GARAGE’ PREMIERES THURSDAY, APRIL 19 AT 10PM ET/PT", "performance_score": 0, "site": "cnbc.com", "participants_count": 1, "title_full": "", "spam_score": 0.0, "site_type": "news", "published": "2018-03-21T22:16:00.000+02:00", "replies_count": 0, "uuid": "1c93a0527f4b0d8f985703da92b5002e2c7a5c65"}, "author": "cnbc.com", "url": "http://www.cnbc.com/2018/03/21/an-all-new-supersized-jay-lenos-garage-premieres-thursday-april-19-at-10pm-etpt.html", "ord_in_thread": 0, "title": "AN ALL-NEW SUPERSIZED ‘JAY LENO’S GARAGE’ PREMIERES THURSDAY, APRIL 19 AT 10PM ET/PT", "locations": [], "entities": {"persons": [{"name": "jay leno", "sentiment": "negative"}, {"name": "jamie foxx", "sentiment": "negative"}, {"name": "ben collins", "sentiment": "none"}, {"name": "mustang steve mcqueen", "sentiment": "none"}, {"name": "mitt romney", "sentiment": "none"}, {"name": "jay le", "sentiment": "none"}, {"name": "jay", "sentiment": "none"}, {"name": "chris hardwick", "sentiment": "none"}, {"name": "james taylor", "sentiment": "none"}, {"name": "martha reeves", "sentiment": "none"}, {"name": "billy crystal", "sentiment": "none"}, {"name": "terry crews", "sentiment": "none"}, {"name": "yankovic", "sentiment": "none"}, {"name": "tyler perry", "sentiment": "none"}, {"name": "guy fieri", "sentiment": "none"}, {"name": "trevor noah", "sentiment": "none"}, {"name": "bond", "sentiment": "none"}], "locations": [{"name": "n.j.", "sentiment": "none"}], "organizations": [{"name": "jay attempt donuts", "sentiment": "negative"}, {"name": "cnbc", "sentiment": "none"}]}, "highlightText": "", "language": "english", "persons": [], "text": "Jamie Foxx and Jay Attempt Donuts and Burnouts in the Season Premiere…Don't Try This At Home!\nENGLEWOOD CLIFFS, N.J. — March 21, 2018 — CNBC today announced an all-new 16 episode season of \"Jay Leno's Garage\" premieres Thursday, April 19 th at 10PM ET/PT . In each one-hour episode, Jay and his famous friends are seeking all sorts of automotive fun. Celebrity guests this season include Jamie Foxx, Billy Crystal, Terry Crews, Tyler Perry, Mitt Romney, Trevor Noah, James Taylor, \"Weird Al\" Yankovic, Martha Reeves, Guy Fieri, Chris Hardwick, and more.\nIn the premiere episode, the movie car is finally the star of the show! Jamie Foxx shows Jay that he's no baby driver when it comes to doing his own stunts. Then Jay and Bond stunt driver Ben Collins recreate the iconic chase scene from \"The Spy Who Loved Me.\" Jay gets an exclusive look at the original Mustang Steve McQueen drove in the film \"Bullitt.\" And musician James Taylor gets reunited with the car from his cult classic film \"Two Lane Blacktop.\" It's an action-packed look at the cars that co-star in some of our favorite films.\n\"Jay Leno's Garage\" takes the fast and the furious car fan for a high-octane spin across the country with a mix of stunts, reviews, celebrity interviews and challenges. As well as putting some of the world's most amazing vehicles through their paces, Jay meets fellow car enthusiasts from who he'll discover the touching, hilarious and sometimes hard to believe stories that make these cars more than just rubber and metal. There's no wheel Jay won't get behind to tell the story of our love affair with the automobile.\n\"Jay Leno's Garage\" is produced by Original Productions, a FremantleMedia Company, and Kitten Kaboodle, with Jay Leno, Sarah Whalen, Jeff Bumgarner, Ernie Avila and Abby Schwarzwalder as executive producers. Jim Ackerman and Adam Barry are the executive producers for CNBC.\nFor more information, visit jaylenosgarage.cnbc.com . Like us on Facebook https://www.facebook.com/jaylenosgarage/ , follow us on Instagram https://www.instagram.com/jaylenosgarage/ and follow us on Twitter @LenosGarage .\nAbout CNBC:\nWith CNBC in the U.S., CNBC in Asia Pacific, CNBC in Europe, Middle East and Africa, and CNBC World, CNBC is the recognized world leader in business news and provides real-time financial market coverage and business information to more than 409 million homes worldwide, including more than 91 million households in the United States and Canada. CNBC also provides daily business updates to 400 million households across China. The network's 15 live hours a day of business programming in North America (weekdays from 4:00 a.m. - 7:00 p.m. ET) is produced at CNBC's global headquarters in Englewood Cliffs, N.J., and includes reports from CNBC News bureaus worldwide. CNBC at night features a mix of new reality programming, CNBC's highly successful series produced exclusively for CNBC and a number of distinctive in-house documentaries.\nCNBC Digital delivers more than 50 million multi-platform unique visitors each month. CNBC.com provides real-time financial market news and information to CNBC's investor audience. CNBC Make It is a digital destination focused on making you smarter about how you earn, save and spend your money by zeroing in on careers, leadership, entrepreneurship and personal finance.\nCNBC has a vast portfolio of digital products across a variety of platforms including: CNBC.com; CNBC PRO, the premium, integrated desktop/mobile service that provides live access to CNBC programming, exclusive video content and global market data and analysis; a suite of CNBC mobile products including the CNBC Apps for iOS, Android and Windows devices; and additional products such as the CNBC App for the Apple Watch and Apple TV.\nMembers of the media can receive more information about CNBC and its programming on the NBCUniversal Media Village Web site at http://www.nbcumv.com/programming/cnbc .\nFor more information about NBCUniversal, please visit http://www.NBCUniversal.com .\nAbout Original Productions:\nThe Original Productions team, led by Sarah Whalen, EVP Development & Programming and Ernie Avila, COO & EVP Business Affairs, is a world-wide, culture-changing force in unscripted reality television. More than 180 countries world-wide watch Original Productions' shows. With titles such as Deadliest Catch, Deadliest Catch: Dungeon Cove, Bering Sea Gold, Ice Road Truckers, Ax Men, Jay Leno's Garage, and The Confession Tapes. Original Productions has been creating culture-changing television for over 17 years. For all things 'original' go to http://www.origprod.com/ .\nAbout Big Dog Productions, Inc.:\nJay Leno, Executive Producer and CEO, is a well-established entertainment enterprise, producing the Tonight Show with Jay Leno for 22 years, producing and managing Jay Leno's Comedy Stand-up appearances as well as voice over, film and television appearances. Kitten Kaboodle owns Jay Leno's Garage series.", "external_links": ["http://www.nbcuniversal.com/", "https://www.instagram.com/jaylenosgarage/", "https://www.facebook.com/jaylenosgarage/", "http://www.nbcumv.com/programming/cnbc", "http://media.ne.cision.com/l/jjepylfw/www.cnbc.com/jay-lenos-garage", "https://wpyadmin.ne.cision.com/l/jjepylfw/twitter.com/LenosGarage", "http://www.origprod.com/"], "published": "2018-03-21T22:16:00.000+02:00", "crawled": "2018-03-22T00:43:13.006+02:00", "highlightTitle": ""}