{"organizations": [], "uuid": "23ffc1f7bbd8b8c84b07f8d7a33a9f5cf875b738", "thread": {"social": {"gplus": {"shares": 0}, "pinterest": {"shares": 0}, "vk": {"shares": 0}, "linkedin": {"shares": 0}, "facebook": {"likes": 0, "shares": 0, "comments": 0}, "stumbledupon": {"shares": 0}}, "site_full": "www.cnbc.com", "main_image": "", "site_section": "http://www.cnbc.com/id/10000027", "section_title": "Press Releases - CNBC", "url": "http://www.cnbc.com/2018/03/05/cnbc-to-broadcast-live-from-ceraweek-by-ihs-markit-march-5-8.html", "country": "US", "domain_rank": 767, "title": "CNBC TO BROADCAST LIVE FROM CERAWEEK BY IHS MARKIT MARCH 5-8", "performance_score": 0, "site": "cnbc.com", "participants_count": 1, "title_full": "", "spam_score": 0.0, "site_type": "news", "published": "2018-03-05T23:18:00.000+02:00", "replies_count": 0, "uuid": "23ffc1f7bbd8b8c84b07f8d7a33a9f5cf875b738"}, "author": "cnbc.com", "url": "http://www.cnbc.com/2018/03/05/cnbc-to-broadcast-live-from-ceraweek-by-ihs-markit-march-5-8.html", "ord_in_thread": 0, "title": "CNBC TO BROADCAST LIVE FROM CERAWEEK BY IHS MARKIT MARCH 5-8", "locations": [], "entities": {"persons": [{"name": "jackie deangelis", "sentiment": "negative"}, {"name": "brian sullivan", "sentiment": "negative"}, {"name": "charles leykum", "sentiment": "none"}, {"name": "kate rich", "sentiment": "none"}, {"name": "ben van beurden", "sentiment": "none"}, {"name": "deangelis", "sentiment": "none"}, {"name": "sullivan", "sentiment": "none"}, {"name": "pedro parente", "sentiment": "none"}, {"name": "david farr", "sentiment": "none"}, {"name": "bob dudley", "sentiment": "none"}, {"name": "amin nasser", "sentiment": "none"}, {"name": "robert kaplan", "sentiment": "none"}, {"name": "dan yergin", "sentiment": "none"}, {"name": "jack fusco", "sentiment": "none"}], "locations": [{"name": "tx", "sentiment": "none"}, {"name": "houston", "sentiment": "none"}], "organizations": [{"name": "cnbc", "sentiment": "negative"}, {"name": "csl capital management", "sentiment": "none"}, {"name": "petrobras", "sentiment": "none"}, {"name": "iea", "sentiment": "none"}, {"name": "federal reserve bank of dallas", "sentiment": "none"}, {"name": "ihs markit", "sentiment": "none"}, {"name": "emerson", "sentiment": "none"}, {"name": "bp", "sentiment": "none"}, {"name": "fatih birol", "sentiment": "none"}, {"name": "cheniere", "sentiment": "none"}, {"name": "shell", "sentiment": "none"}, {"name": "saudi aramco", "sentiment": "none"}, {"name": "international energy agency", "sentiment": "none"}, {"name": "cnbc digital", "sentiment": "none"}]}, "highlightText": "", "language": "english", "persons": [], "text": "CNBC's Brian Sullivan and Jackie DeAngelis Report for the Network\nCNBC, First in Business Worldwide, will broadcast live from CERAWeek by IHS Markit in Houston, TX, Monday, March 5 through Thursday, March 8. Sullivan will anchor CNBC's \"Power Lunch\" (M-F, 1PM-3PM ET) and DeAngelis will cover the news from the conference during CNBC's Business Day programming. Both will conduct interviews for the network.\nThe CNBC Digital team will also contribute reporting online throughout the conference. All of CNBC's coverage will be available at https://www.cnbc.com/ceraweek .\nGuests from the conference include (additional guests to be announced):\nMonday, March 5\nFatih Birol, International Energy Agency (IEA) Executive Director\nPedro Parente , Petrobras CEO\nTuesday, March 6\nRobert Kaplan, Federal Reserve Bank of Dallas President\nDan Yergin , IHS Markit Vice Chairman\nAmin Nasser, Saudi Aramco President and CEO\nDavid Farr, Emerson Chairman and CEO\nJack Fusco, Cheniere President and CEO\nBob Dudley, BP CEO\nCharles Leykum , CSL Capital Management\nWednesday, March 7\nBen van Beurden, Shell CEO\nKate Richard, Warwick Energy Group Founder and CEO\nFor more information contact:\nJennifer Dauble\nCNBC\nt: 201.735.4721\nm: 201.615.2787\ne: jennifer.dauble@nbcuni.com\nEmma Martin\nCNBC\nt: 201.735.4713\nm: 551.275.5221\ne: emma.martin@nbcuni.com", "external_links": [], "published": "2018-03-05T23:18:00.000+02:00", "crawled": "2018-03-06T00:37:19.016+02:00", "highlightTitle": ""}