{"organizations": [], "uuid": "272193b1c3ed09a1094aae8860f5eb60faee4d06", "thread": {"social": {"gplus": {"shares": 0}, "pinterest": {"shares": 0}, "vk": {"shares": 0}, "linkedin": {"shares": 0}, "facebook": {"likes": 0, "shares": 0, "comments": 0}, "stumbledupon": {"shares": 0}}, "site_full": "www.cnbc.com", "main_image": "", "site_section": "http://www.cnbc.com/id/10000027/page/2", "section_title": "Press Releases - CNBC", "url": "http://www.cnbc.com/2018/03/02/cnbc-exclusive-media-alert-dallas-fed-president-robert-kaplan-to-speak-with-cnbcs-steve-liesman-tuesday-march-6-at-800am-et.html", "country": "US", "domain_rank": 767, "title": "CNBC EXCLUSIVE: MEDIA ALERT: DALLAS FED PRESIDENT ROBERT KAPLAN TO SPEAK WITH CNBC’S STEVE LIESMAN TUESDAY MARCH 6 AT 8:00AM ET", "performance_score": 0, "site": "cnbc.com", "participants_count": 1, "title_full": "", "spam_score": 0.068, "site_type": "news", "published": "2018-03-02T18:26:00.000+02:00", "replies_count": 0, "uuid": "272193b1c3ed09a1094aae8860f5eb60faee4d06"}, "author": "cnbc.com", "url": "http://www.cnbc.com/2018/03/02/cnbc-exclusive-media-alert-dallas-fed-president-robert-kaplan-to-speak-with-cnbcs-steve-liesman-tuesday-march-6-at-800am-et.html", "ord_in_thread": 0, "title": "CNBC EXCLUSIVE: MEDIA ALERT: DALLAS FED PRESIDENT ROBERT KAPLAN TO SPEAK WITH CNBC’S STEVE LIESMAN TUESDAY MARCH 6 AT 8:00AM ET", "locations": [], "entities": {"persons": [{"name": "robert kaplan", "sentiment": "negative"}, {"name": "emma martin", "sentiment": "none"}, {"name": "kaplan", "sentiment": "none"}, {"name": "steve liesman", "sentiment": "none"}, {"name": "jennifer dauble", "sentiment": "none"}], "locations": [{"name": "middle east", "sentiment": "none"}, {"name": "canada", "sentiment": "none"}, {"name": "u.s.", "sentiment": "none"}, {"name": "tx", "sentiment": "none"}, {"name": "asia pacific", "sentiment": "none"}, {"name": "united states", "sentiment": "none"}, {"name": "europe", "sentiment": "none"}, {"name": "china", "sentiment": "none"}, {"name": "africa", "sentiment": "none"}, {"name": "houston", "sentiment": "none"}], "organizations": [{"name": "cnbc", "sentiment": "negative"}, {"name": "cnbc world", "sentiment": "none"}, {"name": "ihs", "sentiment": "none"}, {"name": "dallas fed", "sentiment": "none"}]}, "highlightText": "", "language": "english", "persons": [], "text": "WHEN: Tuesday, March 6, 2018 at 8:00AM ET\nWHERE: CNBC's \"Squawk Box\"\nIn a CNBC EXCLUSIVE interview, CNBC's Steve Liesman will speak with Dallas Fed President Robert Kaplan on CNBC's \"Squawk Box\" (M-F 9AM-11AM) Tuesday, March 6th at 8:00AM ET. Kaplan will be live from IHS CERAWeek 2018 in Houston, TX. Topics will include: monetary policy, economic outlook, energy industry, and trade, among others.\nTranscript to follow interview.\nFor more information contact:\nJennifer Dauble\nCNBC\nt: 201.735.4721\nm: 201.615.2787\ne: jennifer.dauble@nbcuni.com\nEmma Martin\nCNBC\nt: 201.735.4713\nm: 551.275.5221\ne: emma.martin@nbcuni.com\nAbout CNBC:\nWith CNBC in the U.S., CNBC in Asia Pacific, CNBC in Europe, Middle East and Africa, and CNBC World, CNBC is the recognized world leader in business news and provides real-time financial market coverage and business information to more than 409 million homes worldwide, including more than 91 million households in the United States and Canada. CNBC also provides daily business updates to 400 million households across China. The network's 15 live hours a day of business programming in North America (weekdays from 4:00 a.m. - 7:00 p.m. ET) is produced at CNBC's global headquarters in Englewood Cliffs, N.J., and includes reports from CNBC News bureaus worldwide. CNBC at night features a mix of new reality programming, CNBC's highly successful series produced exclusively for CNBC and a number of distinctive in-house documentaries.\nCNBC also has a vast portfolio of digital products which deliver real-time financial market news and information across a variety of platforms including: CNBC.com; CNBC PRO, the premium, integrated desktop/mobile service that provides live access to CNBC programming, exclusive video content and global market data and analysis; a suite of CNBC mobile products including the CNBC Apps for iOS, Android and Windows devices; and additional products such as the CNBC App for the Apple Watch and Apple TV.\nMembers of the media can receive more information about CNBC and its programming on the NBCUniversal Media Village Web site at http://www.nbcumv.com/programming/cnbc .\nFor more information about NBCUniversal, please visit http://www.NBCUniversal.com .", "external_links": ["https://wpyadmin.ne.cision.com/l/yzodcwjy/www.cnbc.com/squawk-box-us", "http://www.nbcumv.com/programming/cnbc"], "published": "2018-03-02T18:26:00.000+02:00", "crawled": "2018-03-02T19:29:22.012+02:00", "highlightTitle": ""}